{
  "edges": [
    {
      "relation": "PARENT_OF",
      "source": "git:master",
      "target": "git:2ab8b77c3b6f"
    }
  ],
  "generated_from_head": "2ab8b77c3b6fd6a84ad8845f6edd5c12f63e77e7",
  "generated_from_tree": "8c51af748a5487059dcf3bf37df870bc26f6718b",
  "graph_digest": "a2387eea3580abef2ba0b55e41aa9a5d6ce2579c88bc932488a836b1fca22556",
  "graph_digest_domain": "LION/GIT-LOGICAL-TREE/3",
  "invariants": [
    "NO_AUTHORITY_FROM_GRAPH",
    "RUNTIME_IS_SEPARATE_FROM_REPOSITORY",
    "RAG_IS_NOT_LIVE_TRUTH",
    "LOCAL_CURRENT_HEAD_DESCENDS_FROM_TRACKED_MASTER"
  ],
  "nodes": [
    {
      "authority_state": "NONE_BY_THIS_NODE",
      "currentness": "CURRENT_LOCAL_LINEAGE",
      "evidence_refs": [
        "git-object:2ab8b77c3b6fd6a84ad8845f6edd5c12f63e77e7"
      ],
      "head": "2ab8b77c3b6fd6a84ad8845f6edd5c12f63e77e7",
      "integration_state": "LOCAL_UNPUBLISHED",
      "node_id": "git:2ab8b77c3b6f",
      "node_type": "LOCAL_EVOLUTION_COMMIT",
      "notes": "feat(r8): add bounded hybrid routing candidate",
      "observed_at": null,
      "parent_heads": [
        "473afeb5fcdc7b5dabac00cef617f8067b285a29"
      ],
      "rag_release": null,
      "ref": "",
      "repository": "DonkeyJJLove/ai_platform",
      "runtime_state": "NOT_DEPLOYED",
      "superseded_by": [],
      "supersedes": [],
      "tree": "8c51af748a5487059dcf3bf37df870bc26f6718b",
      "truth_subject": null
    },
    {
      "authority_state": "NONE_BY_THIS_NODE",
      "currentness": "CURRENT_REMOTE_TRACKING_EXACT",
      "evidence_refs": [
        "git-object:473afeb5fcdc7b5dabac00cef617f8067b285a29"
      ],
      "head": "473afeb5fcdc7b5dabac00cef617f8067b285a29",
      "integration_state": "MERGED",
      "node_id": "git:master",
      "node_type": "REMOTE_MASTER",
      "notes": "Remote-tracking snapshot; network currentness must be reacquired separately.",
      "observed_at": null,
      "parent_heads": [],
      "rag_release": null,
      "ref": "master",
      "repository": "DonkeyJJLove/ai_platform",
      "runtime_state": "REPOSITORY_ONLY",
      "superseded_by": [],
      "supersedes": [],
      "tree": "121a275cfef896627bf79d59529172535ed4dfaa",
      "truth_subject": null
    }
  ],
  "project": "LION_EVOLUSION",
  "repository": "DonkeyJJLove/ai_platform",
  "schema": "lion.git-logical-tree/v3",
  "snapshot_semantics": "Exact deterministic pre-commit Git snapshot. Later documentation/truth commits are valid descendants; read live carriers for final truth binding."
}
